Course Catalogue Number,Department Name,Course Name,Course Description,Graduate/Undergraduate,Format,Lab,Academic Catalogue Year,Food Systems,Food Justice/Equity,Critical Pedagogy
5000,AGIN,Master's Thesis/Report in International Agriculture,"For students working on a masters degree in International Agriculture. Independent research and thesis under the direction and supervision of a major professor.

Offered for variable credit, 1-6 credit hours, maximum of 6 credit hours.
",Graduate,Independent Study,False,2019-2020,,,
5312,AGIN,Applied Issues in International Agriculture and Natural Resources,"Applied global issues in international agriculture and natural resource development, including sustainability, food security, trade, project evaluation, and international agricultural institutions. Written and oral reports and discussion of selected topics. Previously offered as AG 5010.

",Graduate,Lecture,False,2019-2020,,,
5312,AGIN,Applied Issues in International Agriculture and Natural Resources,"Applied global issues in international agriculture and natural resource development, including sustainability, food security, trade, project evaluation, and international agricultural institutions. Written and oral reports and discussion of selected topics. Previously offered as AG 5010.

",Graduate,Lecture,False,2019-2020,,,
5333,AGIN,Guided Reading in International Agriculture and Natural Resources,"Understanding of international agricultural development objectives, challenges, and solutions to the most critical problems facing the developing world's food and agricultural systems, through readings of a set of classic and contemporary books and constructing book reports.

",Graduate,Lecture,False,2019-2020,,,
5333,AGIN,Guided Reading in International Agriculture and Natural Resources,"Understanding of international agricultural development objectives, challenges, and solutions to the most critical problems facing the developing world's food and agricultural systems, through readings of a set of classic and contemporary books and constructing book reports.

",Graduate,Lecture,False,2019-2020,,,
5353,AGIN,Advanced Case Studies in Agricultural Marketing and International Development,"Advanced real world issues in marketing and international development of agricultural and food products. Development of an understanding of issues facing policy makers, producers, consumers, and other groups in examining the costs and benefits of various international marketing, trade and development programs. 

",Graduate,Lecture,False,2019-2020,,,
5353,AGIN,Advanced Case Studies in Agricultural Marketing and International Development,"Advanced real world issues in marketing and international development of agricultural and food products. Development of an understanding of issues facing policy makers, producers, consumers, and other groups in examining the costs and benefits of various international marketing, trade and development programs. 

",Graduate,Lecture,False,2019-2020,,,
5800,AGIN,International Agriculture Internship Experience,"Students conducting an international internship experience, under the direction and supervision of a faculty member. Previously offered as AG 5100.

Offered for variable credit, 1-6 credit hours, maximum of 12 credit hours.

",Graduate,Lecture,False,2019-2020,,,
5990,AGIN,Advanced Studies in International Agriculture and Natural Resources,"Individual or small group study and/or research in international agriculture and natural resources.

Offered for variable credit, 1-12 credit hours, maximum of 15 credit hours.

",Graduate,Independent Study,False,2019-2020,,,
2113,AGCM,Introduction to Agricultural Communications,"Fundamentals of agricultural news writing and other communication methods. Careers in and the role of the media in agriculture and related fields.  Previously offered as AGCM 2103 and AGCM 4453.

",Undergraduate,Lecture,False,2019-2020,,,
3100,AGCM,Special Topics in Agricultural Communications,"Investigation of specialized and/or advanced topics and issues related to agricultural communications. Previously offered as AGCM 3101.

Offered for variable credit, 1-3 credit hours, maximum of 6 credit hours.

",Undergraduate,Independent Study,False,2019-2020,,,
3103,AGCM,Written Communications in Agricultural Sciences and Natural Resources,"Understanding and application of writing principles and communications theory as related to public issues in agriculture, food and natural resources. 

",Undergraduate,Lecture,False,2019-2020,,,
3103,AGCM,Written Communications in Agricultural Sciences and Natural Resources,"Understanding and application of writing principles and communications theory as related to public issues in agriculture, food and natural resources. 

",Undergraduate,Lecture,False,2019-2020,,,
3113,AGCM,Writing and Editing for Agricultural Publications,"Interviewing, reporting, writing, and editing for agricultural publications.

",Undergraduate,"Lab, Lecture, Combined lecture and lab",True,2019-2020,,,
3123,AGCM,Audio and Video Storytelling in Agricultural Communications,"Exploration and application of audio and video media storytelling techniques for agricultural communicators as used in promoting, marketing and communicating about agriculture, food, natural resources and the environment.

",Undergraduate,"Lab, Lecture, Combined lecture and lab",True,2019-2020,,,
3123,AGCM,Audio and Video Storytelling in Agricultural Communications,"Exploration and application of audio and video media storytelling techniques for agricultural communicators as used in promoting, marketing and communicating about agriculture, food, natural resources and the environment.

",Undergraduate,"Lab, Lecture, Combined lecture and lab",True,2019-2020,,,
3203,AGCM,Oral Communications in Agricultural Sciences & Natural Resources (S),"Application of oral communications skills used in the dissemination of information related to agricultural sciences and natural resources, and related topics.  Acquisition of interpersonal communications skills and small group, impromptu and professional presentation skills.

",Undergraduate,"Lab, Lecture, Combined lecture and lab",True,2019-2020,,,
3213,AGCM,Layout and Design for Agricultural Publications,"Fundamentals of layout and design as applied to agricultural publications. Practical application of design principles, typography, design software and printing practices. 

",Undergraduate,"Lab, Lecture, Combined lecture and lab",True,2019-2020,,,
3223,AGCM,Digital and Online Media in Agricultural Communications,"Fundamentals of using digital and online media and mass communication for agriculture and natural resources, including web, social media and email marketing. Practical application of theory and skills related to design, management and evaluation of digital and online media.

",Undergraduate,"Lab, Lecture, Combined lecture and lab",True,2019-2020,,,
3233,AGCM,Basic Photography and Photo Editing for Agriculture,"Beginning course focusing on photographic equipment, related software and photo composition in an agricultural setting.

",Undergraduate,"Lab, Lecture, Combined lecture and lab",True,2019-2020,,,
3503,AGCM,Issues Management and Crisis Communications in Agriculture and Natural Resources,"Theoretical perspectives and practical applications of issues management, crisis management, and crisis communications principles. Development of knowledge, skills, and abilities necessary for identifying and managing issues faced by organizations; leading organizations through crises; and communicating before, during and after crisis. 

",Undergraduate,Lecture,False,2019-2020,,,
4113,AGCM,Features Writing and Editing for Agricultural Publications,"Brainstorming, researching, interviewing, developing, writing and editing feature stories for agricultural publications.

","Graduate, Undergraduate",Lecture,False,2019-2020,,,
4203,AGCM,Professional Development in Agricultural Communications,"Professional preparation and personal development for careers in agricultural communications, including business communications writing, resume and portfolio development, presentation delivery, financial planning and management, networking, and job interview skills. 

","Graduate, Undergraduate",Lecture,False,2019-2020,,,
4233,AGCM,Agricultural Photography Tour,"Agricultural photography travel course focused on advanced composition techniques including but not limited to night photography, portraits, painting, etc. Students will be exposed to many cultural and agricultural sites from a photographic perspective. No credit for students with credit in AGCM 5233. 



",Undergraduate,"Lab, Lecture, Combined lecture and lab",True,2019-2020,,,
4300,AGCM,Internships in Agricultural Communications,"Supervised work experience with approved employers in agricultural communications. Presentation required following the internship experience. Previously offered as AGCM 4500.

Offered for variable credit, 1-6 credit hours, maximum of 6 credit hours.

",Undergraduate,Independent Study,False,2019-2020,,,
4403,AGCM,Planning Campaigns for Agriculture and Natural Resources,"Communications campaign development for agriculture and natural resources activities and issues, including development of materials, budgets and contracts.

",Undergraduate,"Lab, Lecture, Combined lecture and lab",True,2019-2020,,,
4413,AGCM,Agricultural Communications Capstone,"The development of an agricultural magazine through advanced feature writing and editing, page layout, graphic design, photography, and sponsor communications as well as an understanding of the printing process.

","Graduate, Undergraduate","Lab, Lecture, Combined lecture and lab",True,2019-2020,,,
4990,AGCM,Problems in Agricultural Communications,"Small group and individual study and research in problems relating to communications within the agricultural sector and from the agricultural sector to other constituencies.

",Undergraduate,Independent Study,False,2019-2020,,,
5100,AGCM,Special Topics in Agricultural Communications,"Investigation of specialized and/or advanced topics and issues related to agricultural communications.

Offered for variable credit, 1-3 credit hours, maximum of 6 credit hours.

",Graduate,Independent Study,False,2019-2020,,,
5103,AGCM,History and Philosophical Foundations of Agricultural Communications,"Discussion of the history, philosophical foundations and current issues regarding agricultural communications and the land-grant system.

",Graduate,Lecture,False,2019-2020,,,
5132,AGCM,Writing for Scholarly Publications in Agricultural Sciences and Natural Resources,"Development of scientific writing skills for agricultural sciences and natural resources disciplines, including research proposals, theses, dissertations, conference papers, and journal articles.

",Graduate,Lecture,False,2019-2020,,,
5203,AGCM,Theory and Practice in Agricultural Communications,"The study of major communication theories and theorists in the context of agricultural communications.

",Graduate,Lecture,False,2019-2020,,,
5213,AGCM,Advanced Concepts in Agricultural Publishing,"Analysis, redesign and creation of agricultural publications. Evaluation of audience, production, advertising and editorial content.

",Graduate,Lecture,False,2019-2020,,,
5233,AGCM,Agricultural Photography Tour,"Agricultural photography travel course focused on advanced composition techniques including but not limited to night photography, portraits, painting, etc. Students will be exposed to many cultural and agricultural sites from a photographic perspective. No credit for students with credit in AGCM 4233.


",Graduate,"Lab, Lecture, Combined lecture and lab",True,2019-2020,,,
5303,AGCM,Communicating Ethical Issues in Agriculture,"An introduction to communicating ethical theories in the context of agriculture. Ethical theory and current research are used to critique contemporary issues in agriculture.

",Graduate,Lecture,False,2019-2020,,,
5403,AGCM,Public Relations Campaigns in Agricultural Sciences and Natural Resources,"Public relations campaign development for agriculture and natural resources organizations and issues, including public relations theory, strategic planning and campaign material development. No credit for students with credit in AGCM 4403.

",Graduate,"Lab, Lecture, Combined lecture and lab",True,2019-2020,,,
5503,AGCM,Risk and Crisis Communication in Agricultural Sciences and Natural Resources,"Development of risk and crisis communication skills and knowledge with special emphasis in agricultural sciences and natural resources.
",Graduate,Lecture,False,2019-2020,,,
5990,AGCM,Advanced Studies in Agricultural Communications,"Individual and small group study or research in agricultural communications topics and issues.

Offered for variable credit, 1-6 credit hours, maximum of 6 credit hours.

",Graduate,Independent Study,False,2019-2020,,,
1101,AGEC,Agricultural Economics and Agribusiness Experience,"Developing connections between the student’s major curriculum, career goals specific to agricultural economics or agribusiness, and networking with other students, faculty and alumni.
",Undergraduate,Lecture,False,2019-2020,,,
1113,AGEC,Introduction to Agricultural Economics (S),"Economic theory of production, marketing, and consumption of agricultural products and natural resources. The role and structure of agricultural sciences and natural resources within the American economy. Policies to achieve efficiency and welfare goals in agriculture. No general education credit for students also taking ECON 1113 or ECON 2103. Previously offered as AGEC 1114.
",Undergraduate,Lecture,False,2019-2020,,,
2303,AGEC,Food Marketing to a Diverse Population (D),"Food and beverage demand and preferences of socially and ethnically constructed groups in American Society. Real life issues of marketing to a diverse population, including Native, Asian, African and Hispanic Americans, and low-income populations.
",Undergraduate,Lecture,False,2019-2020,,,
2313,AGEC,Case Studies in Agricultural Trade and Development,"Real world issues in international trade and development of agricultural and food products. Development of an understanding of issues facing policymakers, producers, consumers, and other groups in examining the costs and benefits of various trade and development programs.

",Undergraduate,Lecture,False,2019-2020,,,
2313,AGEC,Case Studies in Agricultural Trade and Development,"Real world issues in international trade and development of agricultural and food products. Development of an understanding of issues facing policymakers, producers, consumers, and other groups in examining the costs and benefits of various trade and development programs.

",Undergraduate,Lecture,False,2019-2020,,,
2990,AGEC,Problems in Agricultural Economics and Agribusiness,"Directed study on topics related to agricultural economics or agribusiness.

Offered for variable credit, 1-3 credit hours, maximum of 6 credit hours.

",Undergraduate,Independent Study,False,2019-2020,,,
3010,AGEC,Internship in Agricultural Economics,"Supervised work experience with approved public and private employers in agricultural economics, including banks, farm credit services, agriculture chemical firms, Soil Conservation Service, congressional offices and other opportunities. Credit will not substitute for required courses. Graded on a pass-fail basis.

Offered for variable credit, 1-3 credit hours, maximum of 3 credit hours.

",Undergraduate,Independent Study,False,2019-2020,,,
3023,AGEC,Farm to Fork,Survey of agriculture and natural resources and their relationships to society. Role of advanced scientific technologies in alternative systems of food production and distribution.,Undergraduate,Lecture,False,2019-2020,,,
3023,AGEC,Farm to Fork,Survey of agriculture and natural resources and their relationships to society. Role of advanced scientific technologies in alternative systems of food production and distribution.,Undergraduate,Lecture,False,2019-2020,,,
3101,AGEC,Professional Career Development,"Overview of the various areas of specialization within agricultural economics and agribusiness and their associated career opportunities and obligations. Development and improvement of written communication, oral communication and leadership skills. Previously offered as AGEC 4902.

",Undergraduate,Lecture,False,2019-2020,,,
3183,AGEC,Agribusiness Accounting and Taxation,"Development of the ability to read, analyze, and use accounting information to improve decision-making and tax planning.  Same course as ACCT 3183.

",Undergraduate,Lecture,False,2019-2020,,,
3213,AGEC,Quantitative Methods in Agricultural Economics,"Indices, graphics, budgeting, interest calculations, compounding and discounting, basic statistic measures, regression, optimization and computer applications.

",Undergraduate,"Lab, Lecture, Combined lecture and lab",True,2019-2020,,,
3323,AGEC,Agricultural Product Marketing and Sales,"Fundamentals of agricultural marketing management and planning applied to specific agricultural product (input and output) marketing problems. Institutional differences between agricultural and non-agricultural marketing environments. The role of the individual sales representative in a marketing and sales organization. Written and oral presentations of marketing and sales information required of all students. Previously offered as AGEC 4313.

",Undergraduate,Lecture,False,2019-2020,,,
3333,AGEC,Agricultural Marketing and Price Analysis,"Supply, demand, and price determination within the institutional environment of agricultural commodity markets. Roles provided by government intervention, marketing agreements, and cooperatives in agricultural markets. Includes graphical, mathematical, and statistical analysis of commodity markets. Fundamentals of futures markets applied to agriculture. Previously offered as AGEC 3303.



","Graduate, Undergraduate",Lecture,False,2019-2020,,,
3403,AGEC,Agricultural Small Business Management,"The essentials of operating an agricultural small business. An introduction to the planning, organizing, marketing, managing, financing, controlling and operating an agricultural small business. Not recommended for agricultural economics or agribusiness majors. No credit for students with prior credit in 4423.

",Undergraduate,Lecture,False,2019-2020,,,
3423,AGEC,Farm and Agribusiness Management,"Fundamentals of managerial functions as applied to agricultural firms. Organization and management of human, financial, and physical assets for the profitable operation of an agricultural business. An introduction to business planning, enterprise budgeting, financial statements and record keeping. Previously offered as AGEC 3413.

",Undergraduate,"Discussion, Combined lecture & discussion, Lecture",False,2019-2020,,,
3463,AGEC,Agricultural Cooperatives,"An evaluation of the fundamental principles, objectives, structure, finance, and management associated with the cooperative organization. An analysis of the cooperative business organization within the modern economy: history, legislation and evolution. An examination of careers related to cooperatives. Previously offered as AGEC 3313.

",Undergraduate,Lecture,False,2019-2020,,,
3603,AGEC,Agricultural Finance,"Analyze farm and agribusiness financial statements. Understand the relationship between firm growth and financial leverage. Time value of money concepts and their application to capital budgeting. Discuss how agricultural lenders acquire and use funds.

",Undergraduate,Lecture,False,2019-2020,,,
3703,AGEC,Issues in Agricultural Policy,"Emerging issues related to agricultural policy in the United States.

",Undergraduate,Lecture,False,2019-2020,,,
3713,AGEC,Agricultural Law,"Survey of law with emphasis on agricultural problems, applications, and strategies for managing legal risk in the agribusiness setting. Contract law, tort law, property law, real estate transactions, business organization, estate planning, debtor/creditor law, environmental law and water/resources law. Previously offered as AGEC 4413.

",Undergraduate,Lecture,False,2019-2020,,,
3803,AGEC,International Agricultural Economics Tour (I),"A two-three week international travel component. An integrated approach to the cultural, agricultural, historical, technological, political, economic, and religious backgrounds of the region. Comparison of the agricultural business environment of the region to that of the U.S. Previously offered as AGEC 4803.



",Undergraduate,Lecture,False,2019-2020,,,
3810,AGEC,Domestic Agricultural Economics Tour,"An integrated approach to the cultural, agricultural, historical, technological, political and economic backgrounds of an agricultural region of the United States.

Offered for variable credit, 1-3 credit hours, maximum of 3 credit hours.

",Undergraduate,Lecture,False,2019-2020,,,
3990,AGEC,Special Problems in Agricultural Economics,"Directed study of selected agricultural economics topics.

Offered for variable credit, 1-3 credit hours, maximum of 3 credit hours.
",Undergraduate,Independent Study,False,2019-2020,,,
4101,AGEC,Agricultural Economics Seminar,"Contemporary problems in agricultural economics. Previously offered as AGEC 4911.

",Undergraduate,Lecture,False,2019-2020,,,
4213,AGEC,Advanced Quantitative Methods in Agricultural Economics,"Quantitative analysis of agricultural production and markets including risk and uncertainty. Introduction to simulation. Development of statistical and software skills. Written presentation of an analysis of data. Previously offered as AGEC 3203.

","Graduate, Undergraduate",Lecture,False,2019-2020,,,
4223,AGEC,Quantitative Supply Chain Management in Agribusiness,"Challenge in food supply chain management. Tools to solve logistics problems including traveling salesperson, vehicle routing, and distribution center problems. Forecasting sales and queuing theory. Introduction to specialized software used in supply chain management. 



","Graduate, Undergraduate",Lecture,False,2019-2020,,,
4223,AGEC,Quantitative Supply Chain Management in Agribusiness,"Challenge in food supply chain management. Tools to solve logistics problems including traveling salesperson, vehicle routing, and distribution center problems. Forecasting sales and queuing theory. Introduction to specialized software used in supply chain management. 



","Graduate, Undergraduate",Lecture,False,2019-2020,,,
4243,AGEC,Researching Consumer Food Preferences,"Design, implementation, and interpretation of research in consumer food preferences. Includes design of consumer surveys, conducting consumer interviews, preparing food and questionnaires for taste-test experiments, targeting and recruiting scientifically valid samples, the statistical analysis of data, and communication of results. Previously offered as FDSC 4243.



","Graduate, Undergraduate",Lecture,False,2019-2020,,,
4343,AGEC,International Agricultural Markets and Trade (I),"Contemporary international agricultural trade theory and applications. Tools to identify, evaluate critically, and seek solutions to complex international trade and development problems, such as gains from trade, comparative advantage, impacts of trade barriers on social welfare, export promotion effectiveness, trade impacts on environment and land degradation, free trade areas and impacts of genetically modified crops on trade.

",Undergraduate,Lecture,False,2019-2020,,,
4423,AGEC,Advanced Agribusiness Management,"Application of modern decision theory in the uncertain environment that the agricultural business operates. Planning, organizing, implementing, coordinating, and controlling problems associated with establishing an agricultural business, achieving firm growth and operating the firm through time. Use of spreadsheets to perform production planning and analysis related to agricultural business operation with linear programming, simulations, and other tools. Analysis of the interaction of resources, prices and production alternatives. Previously offered as AGEC 4323.

","Graduate, Undergraduate",Lecture,False,2019-2020,,,
4513,AGEC,Farm Appraisal,"Estimating the market value of agricultural real estate using the three approaches to value - sales comparison, cost and income approaches. Analysis of sales to value the different characteristics of the farm.

","Graduate, Undergraduate","Lab, Lecture, Combined lecture and lab",True,2019-2020,,,
4613,AGEC,Advanced Agricultural Finance,"Advanced time value of money and financial management concepts as applied to the management of agricultural firms. Incorporating risk into agricultural investment and financial management decisions. Introduction to risk modeling. May not be used for degree credit with AGEC 5603.

",Undergraduate,Lecture,False,2019-2020,,,
4703,AGEC,American Agricultural Policy,"Economic characteristics and problems of agriculture; evolution and significance of programs and policies.

","Graduate, Undergraduate",Lecture,False,2019-2020,,,
4990,AGEC,Problems of Agricultural Economics,"Research on special problems in agricultural economics.

Offered for variable credit, 1-6 credit hours, maximum of 6 credit hours.

","Graduate, Undergraduate",Independent Study,False,2019-2020,,,
5000,AGEC,Master's Thesis/Report,"For students working on an MS degree in agricultural economics. Independent research and thesis under the direction and supervision of a major professor.

Offered for variable credit, 1-6 credit hours, maximum of 6 credit hours.
",Graduate,Independent Study,False,2019-2020,,,
